---------------Controller ID Test----------------
Test Result: PASS

NVME Identify Controller:
vid       : 0x1c5c
ssvid     : 0x1c5c
sn        : HEC4E000190304S0Q   
mn        : HFS512GEJ9X108N                         
fr        : 51002C30
rab       : 3
ieee      : 000000
cmic      : 0
mdts      : 6
cntlid    : 0x1
ver       : 0x10400
rtd3r     : 0x7a120
rtd3e     : 0x7a120
oaes      : 0x200
ctratt    : 0x12
rrls      : 0
cntrltype : 1
fguid     : 00000000-0000-0000-0000-000000000000
crdt1     : 0
crdt2     : 0
crdt3     : 0
nvmsr     : 0
vwci      : 0
mec       : 0
oacs      : 0x17
acl       : 3
aerl      : 7
frmw      : 0x16
lpa       : 0x1e
elpe      : 255
npss      : 4
avscc     : 0x1
apsta     : 0x1
wctemp    : 356
cctemp    : 358
mtfa      : 0
hmpre     : 16384
hmmin     : 16384
tnvmcap   : 0
unvmcap   : 0
rpmbs     : 0
edstt     : 15
dsto      : 1
fwug      : 1
kas       : 0
hctma     : 0x1
mntmt     : 273
mxtmt     : 356
sanicap   : 0x60000002
hmminds   : 0
hmmaxd    : 0
nsetidmax : 0
endgidmax : 1
anatt     : 0
anacap    : 0
anagrpmax : 0
nanagrpid : 0
pels      : 1
domainid  : 0
megcap    : 0
sqes      : 0x66
cqes      : 0x44
maxcmd    : 0
nn        : 1
oncs      : 0xdf
fuses     : 0
fna       : 0
vwc       : 0x7
awun      : 0
awupf     : 0
icsvscc   : 1
nwpc      : 0
acwu      : 0
ocfs      : 0
sgls      : 0
mnan      : 0
maxdna    : 0
maxcna    : 0
oaqd      : 0
subnqn    : nqn.2023-04.com.skhynix:nvme:nvm-subsystem-sn-HEC4E000190304S0Q   
ioccsz    : 0
iorcsz    : 0
icdoff    : 0
fcatt     : 0
msdbd     : 0
ofcs      : 0
ps      0 : mp:4.5000W operational enlat:100 exlat:100 rrt:0 rrl:0
            rwt:0 rwl:0 idle_power:- active_power:-
            active_power_workload:-
ps      1 : mp:3.0000W operational enlat:200 exlat:200 rrt:1 rrl:1
            rwt:1 rwl:1 idle_power:- active_power:-
            active_power_workload:-
ps      2 : mp:0.6000W operational enlat:400 exlat:400 rrt:2 rrl:2
            rwt:2 rwl:2 idle_power:- active_power:-
            active_power_workload:-
ps      3 : mp:0.0150W non-operational enlat:2000 exlat:2000 rrt:3 rrl:3
            rwt:3 rwl:3 idle_power:- active_power:-
            active_power_workload:-
ps      4 : mp:0.0030W non-operational enlat:5000 exlat:10000 rrt:4 rrl:4
            rwt:4 rwl:4 idle_power:- active_power:-
            active_power_workload:-


Disk: nvme0n1, Test Item: 1.Controller_ID, Test Result: PASS
---------------SMART LOG Test----------------
Test Result: PASS

Smart Log for NVME device:nvme0n1 namespace-id:ffffffff
critical_warning			: 0
temperature				: 38 °C (311 K)
available_spare				: 100%
available_spare_threshold		: 10%
percentage_used				: 0%
endurance group critical warning summary: 0
Data Units Read				: 1477 (756.22 MB)
Data Units Written			: 1026 (525.31 MB)
host_read_commands			: 15320
host_write_commands			: 7041
controller_busy_time			: 1
power_cycles				: 51
power_on_hours				: 1925
unsafe_shutdowns			: 33
media_errors				: 0
num_err_log_entries			: 0
Warning Temperature Time		: 0
Critical Composite Temperature Time	: 0
Temperature Sensor 1           : 38 °C (311 K)
Temperature Sensor 2           : 44 °C (317 K)
Thermal Management T1 Trans Count	: 0
Thermal Management T2 Trans Count	: 0
Thermal Management T1 Total Time	: 0
Thermal Management T2 Total Time	: 0


Disk: nvme0n1, Test Item: 2.SMART_Log, Test Result: PASS
---------------Error LOG Test----------------
Test Result: PASS

No error found during error log test


Disk: nvme0n1, Test Item: 3.Error_Log_Check, Test Result: PASS
---------------Device-Self-Test----------------
Short Device self-test started

  Operation Result             : 0
Test Result: PASS

Self Test Result[0]:
  Operation Result             : 0

Disk: nvme0n1, Test Item: 4.Device-Self-Test-2min, Test Result: PASS
---------------Write and Compare Test----------------
Error running command
Write and Compare Test 55: FAIL

Error running command
Write and Compare Test AA: FAIL

Test Result: FAIL


Disk: nvme0n1, Test Item: 5.Write_and_Compare-5seg, Test Result: FAIL
---------------DSM Test----------------
NVMe DSM: success

Test Result: PASS

No error found during dsm test


Disk: nvme0n1, Test Item: 6.DSM_Test, Test Result: PASS
