Test Result: PASS


/dev/sdb:

ATA device, with non-removable media
	Model Number:       WDC WD5000LPCX-24C6HT0                  
	Serial Number:      WD-WX51A44V6801
	Firmware Revision:  02.01A02
	Transport:          Serial, SATA 1.0a, SATA II Extensions, SATA Rev 2.5, SATA Rev 2.6, SATA Rev 3.0
Standards:
	Supported: 9 8 7 6 5 
	Likely used: 9
Configuration:
	Logical		max	current
	cylinders	16383	16383
	heads		16	16
	sectors/track	63	63
	--
	CHS current addressable sectors:    16514064
	LBA    user addressable sectors:   268435455
	LBA48  user addressable sectors:   976773168
	Logical  Sector size:                   512 bytes
	Physical Sector size:                  4096 bytes
	Logical Sector-0 offset:                  0 bytes
	device size with M = 1024*1024:      476940 MBytes
	device size with M = 1000*1000:      500107 MBytes (500 GB)
	cache/buffer size  = 16384 KBytes
	Nominal Media Rotation Rate: 5400
Capabilities:
	LBA, IORDY(can be disabled)
	Queue depth: 32
	Standby timer values: spec'd by Standard, no device specific minimum
	R/W multiple sector transfer: Max = 16	Current = 0
	Advanced power management level: 254
	DMA: mdma0 mdma1 mdma2 udma0 udma1 udma2 udma3 udma4 udma5 *udma6 
	     Cycle time: min=120ns recommended=120ns
	PIO: pio0 pio1 pio2 pio3 pio4 
	     Cycle time: no flow control=120ns  IORDY flow control=120ns
Commands/features:
	Enabled	Supported:
	   *	SMART feature set
	    	Security Mode feature set
	   *	Power Management feature set
	   *	Write cache
	   *	Look-ahead
	   *	Host Protected Area feature set
	   *	WRITE_BUFFER command
	   *	READ_BUFFER command
	   *	DOWNLOAD_MICROCODE
	   *	Advanced Power Management feature set
	    	Power-Up In Standby feature set
	    	SET_MAX security extension
	   *	48-bit Address feature set
	   *	Device Configuration Overlay feature set
	   *	Mandatory FLUSH_CACHE
	   *	FLUSH_CACHE_EXT
	   *	SMART error logging
	   *	SMART self-test
	   *	General Purpose Logging feature set
	   *	64-bit World wide name
	   *	IDLE_IMMEDIATE with UNLOAD
	   *	WRITE_UNCORRECTABLE_EXT command
	   *	{READ,WRITE}_DMA_EXT_GPL commands
	   *	Segmented DOWNLOAD_MICROCODE
	   *	Gen1 signaling speed (1.5Gb/s)
	   *	Gen2 signaling speed (3.0Gb/s)
	   *	Gen3 signaling speed (6.0Gb/s)
	   *	Native Command Queueing (NCQ)
	   *	Host-initiated interface power management
	   *	Phy event counters
	   *	Idle-Unload when NCQ is active
	   *	NCQ priority information
	   *	Host automatic Partial to Slumber transitions
	   *	Device automatic Partial to Slumber transitions
	   *	READ_LOG_DMA_EXT equivalent to READ_LOG_EXT
	   *	DMA Setup Auto-Activate optimization
	    	Device-initiated interface power management
	   *	Software settings preservation
	   *	SMART Command Transport (SCT) feature set
	   *	SCT Write Same (AC2)
	   *	SCT Features Control (AC4)
	   *	SCT Data Tables (AC5)
	    	unknown 206[12] (vendor specific)
	    	unknown 206[13] (vendor specific)
	    	unknown 206[14] (vendor specific)
Security: 
	Master password revision code = 65534
		supported
	not	enabled
	not	locked
	not	frozen
	not	expired: security count
		supported: enhanced erase
	96min for SECURITY ERASE UNIT. 96min for ENHANCED SECURITY ERASE UNIT.
Logical Unit WWN Device Identifier: 50014ee6af46dba5
	NAA		: 5
	IEEE OUI	: 0014ee
	Unique ID	: 6af46dba5
Checksum: correct


Disk: sdb, Test Item: 1.Controller_ID, Test Result: PASS
['sudo', 'skdump', '/dev/sdb']
---------------SMART LOG Test----------------
Test Result: PASS

Device: sat16:/dev/sdb
Type: 16 Byte SCSI ATA SAT Passthru
Size: 476940 MiB
Model: [WDC WD5000LPCX-24C6HT0]
Serial: [WD-WX51A44V6801]
Firmware: [02.01A02]
SMART Available: yes
Quirks:
Awake: yes
SMART Disk Health Good: yes
Off-line Data Collection Status: [Off-line data collection activity was never started.]
Total Time To Complete Off-Line Data Collection: 9120 s
Self-Test Execution Status: [The previous self-test routine completed without error or no self-test has ever been run.]
Percent Self-Test Remaining: 0%
Conveyance Self-Test Available: yes
Short/Extended Self-Test Available: yes
Start Self-Test Available: yes
Abort Self-Test Available: yes
Short Self-Test Polling Time: 2 min
Extended Self-Test Polling Time: 104 min
Conveyance Self-Test Polling Time: 5 min
Bad Sectors: 0 sectors
Powered On: 5.7 years
Power Cycles: 906
Average Powered On Per Power Cycle: 2.3 days
Temperature: 30.0 C
Attribute Parsing Verification: Good
Overall Status: GOOD
ID# Name                        Value Worst Thres Pretty      Raw            Type    Updates Good Good/Past
  1 raw-read-error-rate         200   200    51   0           0x000000000000 prefail online  yes  yes 
  3 spin-up-time                148   142    21   1.6 s       0x2f0600000000 prefail online  yes  yes 
  4 start-stop-count              1     1     0   204856      0x382003000000 old-age online  n/a  n/a 
  5 reallocated-sector-count    200   200   140   0 sectors   0x000000000000 prefail online  yes  yes 
  7 seek-error-rate             200   200    51   0           0x000000000000 prefail online  yes  yes 
  9 power-on-hours               32    32     0   5.7 years   0x75c200000000 old-age online  n/a  n/a 
 10 spin-retry-count            100   100     0   0           0x000000000000 old-age online  n/a  n/a 
 11 calibration-retry-count     100   100     0   0           0x000000000000 old-age online  n/a  n/a 
 12 power-cycle-count           100   100     0   906         0x8a0300000000 old-age online  n/a  n/a 
192 power-off-retract-count     200   200     0   51          0x330000000000 old-age online  n/a  n/a 
193 load-cycle-count              1     1     0   1237031     0x27e012000000 old-age online  n/a  n/a 
194 temperature-celsius-2       113    98     0   30.0 C      0x1e0000000000 old-age online  n/a  n/a 
196 reallocated-event-count     200   200     0   0           0x000000000000 old-age online  n/a  n/a 
197 current-pending-sector      200   200     0   0 sectors   0x000000000000 old-age online  n/a  n/a 
198 offline-uncorrectable       100   253     0   0 sectors   0x000000000000 old-age offline n/a  n/a 
199 udma-crc-error-count        200   200     0   2           0x020000000000 old-age online  n/a  n/a 
200 multi-zone-error-rate       100   253     0   0           0x000000000000 old-age offline n/a  n/a 
240 head-flying-hours            36    36     0   5.4 years   0x44b800000000 old-age online  n/a  n/a 


Disk: sdb, Test Item: 2.SMART_Log, Test Result: PASS
