Test Result: PASS


/dev/sdc:

ATA device, with non-removable media
	Model Number:       HGST HTS545050A7E380                    
	Serial Number:      TE85113R170MKK
	Firmware Revision:  GG2OACD0
	Transport:          Serial, ATA8-AST, SATA 1.0a, SATA II Extensions, SATA Rev 2.5, SATA Rev 2.6; Revision: ATA8-AST T13 Project D1697 Revision 0b
Standards:
	Used: unknown (minor revision code 0x0028) 
	Supported: 8 7 6 5 
	Likely used: 8
Configuration:
	Logical		max	current
	cylinders	16383	16383
	heads		16	16
	sectors/track	63	63
	--
	CHS current addressable sectors:    16514064
	LBA    user addressable sectors:   268435455
	LBA48  user addressable sectors:   976773168
	Logical  Sector size:                   512 bytes
	Physical Sector size:                  4096 bytes
	Logical Sector-0 offset:                  0 bytes
	device size with M = 1024*1024:      476940 MBytes
	device size with M = 1000*1000:      500107 MBytes (500 GB)
	cache/buffer size  = 8192 KBytes (type=DualPortCache)
	Form Factor: 2.5 inch
	Nominal Media Rotation Rate: 5400
Capabilities:
	LBA, IORDY(can be disabled)
	Queue depth: 32
	Standby timer values: spec'd by Standard, no device specific minimum
	R/W multiple sector transfer: Max = 16	Current = 16
	Advanced power management level: 254
	DMA: mdma0 mdma1 mdma2 udma0 udma1 udma2 udma3 udma4 udma5 *udma6 
	     Cycle time: min=120ns recommended=120ns
	PIO: pio0 pio1 pio2 pio3 pio4 
	     Cycle time: no flow control=120ns  IORDY flow control=120ns
Commands/features:
	Enabled	Supported:
	   *	SMART feature set
	    	Security Mode feature set
	   *	Power Management feature set
	   *	Write cache
	   *	Look-ahead
	   *	Host Protected Area feature set
	   *	WRITE_BUFFER command
	   *	READ_BUFFER command
	   *	NOP cmd
	   *	DOWNLOAD_MICROCODE
	   *	Advanced Power Management feature set
	    	Power-Up In Standby feature set
	   *	SET_FEATURES required to spinup after power up
	    	SET_MAX security extension
	   *	48-bit Address feature set
	   *	Device Configuration Overlay feature set
	   *	Mandatory FLUSH_CACHE
	   *	FLUSH_CACHE_EXT
	   *	SMART error logging
	   *	SMART self-test
	   *	General Purpose Logging feature set
	   *	WRITE_{DMA|MULTIPLE}_FUA_EXT
	   *	64-bit World wide name
	   *	IDLE_IMMEDIATE with UNLOAD
	   *	WRITE_UNCORRECTABLE_EXT command
	   *	{READ,WRITE}_DMA_EXT_GPL commands
	   *	Segmented DOWNLOAD_MICROCODE
	   *	Gen1 signaling speed (1.5Gb/s)
	   *	Gen2 signaling speed (3.0Gb/s)
	   *	Native Command Queueing (NCQ)
	   *	Host-initiated interface power management
	   *	Phy event counters
	   *	Idle-Unload when NCQ is active
	   *	NCQ priority information
	    	Non-Zero buffer offsets in DMA Setup FIS
	   *	DMA Setup Auto-Activate optimization
	    	Device-initiated interface power management
	    	In-order data delivery
	   *	Software settings preservation
	   *	SMART Command Transport (SCT) feature set
	   *	SCT Write Same (AC2)
	   *	SCT Error Recovery Control (AC3)
	   *	SCT Features Control (AC4)
	   *	SCT Data Tables (AC5)
Security: 
	Master password revision code = 65534
		supported
	not	enabled
	not	locked
	not	frozen
	not	expired: security count
		supported: enhanced erase
	110min for SECURITY ERASE UNIT. 112min for ENHANCED SECURITY ERASE UNIT.
Logical Unit WWN Device Identifier: 5000cca6f8d14878
	NAA		: 5
	IEEE OUI	: 000cca
	Unique ID	: 6f8d14878
Checksum: correct


Disk: sdc, Test Item: 1.Controller_ID, Test Result: PASS
['sudo', 'skdump', '/dev/sdc']
---------------SMART LOG Test----------------
Test Result: PASS

Device: sat16:/dev/sdc
Type: 16 Byte SCSI ATA SAT Passthru
Size: 476940 MiB
Model: [HGST HTS545050A7E380]
Serial: [TE85113R170MKK]
Firmware: [GG2OACD0]
SMART Available: yes
Quirks:
Awake: yes
SMART Disk Health Good: yes
Off-line Data Collection Status: [Off-line data collection activity was never started.]
Total Time To Complete Off-Line Data Collection: 45 s
Self-Test Execution Status: [The previous self-test routine completed without error or no self-test has ever been run.]
Percent Self-Test Remaining: 0%
Conveyance Self-Test Available: no
Short/Extended Self-Test Available: yes
Start Self-Test Available: yes
Abort Self-Test Available: yes
Short Self-Test Polling Time: 2 min
Extended Self-Test Polling Time: 112 min
Conveyance Self-Test Polling Time: 0 min
Bad Sectors: 0 sectors
Powered On: 6.5 months
Power Cycles: 6400
Average Powered On Per Power Cycle: 43.6 min
Temperature: 28.0 C
Attribute Parsing Verification: Good
Overall Status: GOOD
ID# Name                        Value Worst Thres Pretty      Raw            Type    Updates Good Good/Past
  1 raw-read-error-rate         100   100    62   0           0x000000000000 prefail online  yes  yes 
  2 throughput-performance      100   100    40   n/a         0x000000000000 prefail offline yes  yes 
  3 spin-up-time                214   214    33   1 ms        0x010000000e00 prefail online  yes  yes 
  4 start-stop-count             84    84     0   25828       0xe46400000000 old-age online  n/a  n/a 
  5 reallocated-sector-count    100   100     5   0 sectors   0x000000000000 prefail online  yes  yes 
  7 seek-error-rate             100   100    67   0           0x000000000000 prefail online  yes  yes 
  8 seek-time-performance       100   100    40   n/a         0x000000000000 prefail offline yes  yes 
  9 power-on-hours               90    90     0   6.5 months  0x291200000000 old-age online  n/a  n/a 
 10 spin-retry-count            100   100    60   0           0x000000000000 prefail online  yes  yes 
 12 power-cycle-count            96    96     0   6400        0x001900000000 old-age online  n/a  n/a 
191 g-sense-error-rate          100   100     0   0           0x000000000000 old-age online  n/a  n/a 
192 power-off-retract-count     100   100     0   74          0x4a0000000000 old-age online  n/a  n/a 
193 load-cycle-count             93    93     0   71760       0x501801000000 old-age online  n/a  n/a 
194 temperature-celsius-2       214   214     0   28.0 C      0x1c000f002a00 old-age online  n/a  n/a 
196 reallocated-event-count     100   100     0   0           0x000000000000 old-age online  n/a  n/a 
197 current-pending-sector      100   100     0   0 sectors   0x000000000000 old-age online  n/a  n/a 
198 offline-uncorrectable       100   100     0   0 sectors   0x000000000000 old-age offline n/a  n/a 
199 udma-crc-error-count        200   200     0   0           0x000000000000 old-age online  n/a  n/a 
223 load-retry-count            100   100     0   0           0x000000000000 old-age online  n/a  n/a 


Disk: sdc, Test Item: 2.SMART_Log, Test Result: PASS
